{
  "schemaVersion": 1,
  "replayId": "replay_031",
  "artifactClass": "life_state_transition_candidates",
  "sourceMethod": "replay_sourced_compact_transition_observation",
  "generatedBy": "tools/emit-life-state-transition-candidates.mjs",
  "generatedAt": "task_182",
  "rawDataCaptured": false,
  "fieldValuesCaptured": false,
  "rawTicksIncluded": false,
  "rawTimestampsIncluded": false,
  "finalFactsProduced": false,
  "gameplayInterpretationProduced": false,
  "participantIdentityArtifactFound": true,
  "participantMappingStatus": "available",
  "samplingPolicy": "one_second_source_sampling",
  "normalizedTimeBaseStatus": "available",
  "transitionCandidates": [
    {
      "transitionKey": "life_transition_000001",
      "participantKey": "participant_02",
      "transitionType": "death_counter_increment_candidate",
      "timeRefKey": "time_ref_000001",
      "normalizedElapsedSecond": 121,
      "sourceSignal": "controller_death_counter_increment",
      "sourceSignalStatus": "available",
      "candidateConfidence": "high",
      "finalFact": false
    },
    {
      "transitionKey": "life_transition_000002",
      "participantKey": "participant_08",
      "transitionType": "death_counter_increment_candidate",
      "timeRefKey": "time_ref_000002",
      "normalizedElapsedSecond": 152,
      "sourceSignal": "controller_death_counter_increment",
      "sourceSignalStatus": "available",
      "candidateConfidence": "high",
      "finalFact": false
    },
    {
      "transitionKey": "life_transition_000003",
      "participantKey": "participant_03",
      "transitionType": "death_counter_increment_candidate",
      "timeRefKey": "time_ref_000003",
      "normalizedElapsedSecond": 232,
      "sourceSignal": "controller_death_counter_increment",
      "sourceSignalStatus": "available",
      "candidateConfidence": "high",
      "finalFact": false
    },
    {
      "transitionKey": "life_transition_000004",
      "participantKey": "participant_05",
      "transitionType": "death_counter_increment_candidate",
      "timeRefKey": "time_ref_000004",
      "normalizedElapsedSecond": 255,
      "sourceSignal": "controller_death_counter_increment",
      "sourceSignalStatus": "available",
      "candidateConfidence": "high",
      "finalFact": false
    },
    {
      "transitionKey": "life_transition_000005",
      "participantKey": "participant_10",
      "transitionType": "death_counter_increment_candidate",
      "timeRefKey": "time_ref_000005",
      "normalizedElapsedSecond": 345,
      "sourceSignal": "controller_death_counter_increment",
      "sourceSignalStatus": "available",
      "candidateConfidence": "high",
      "finalFact": false
    },
    {
      "transitionKey": "life_transition_000006",
      "participantKey": "participant_04",
      "transitionType": "death_counter_increment_candidate",
      "timeRefKey": "time_ref_000006",
      "normalizedElapsedSecond": 360,
      "sourceSignal": "controller_death_counter_increment",
      "sourceSignalStatus": "available",
      "candidateConfidence": "high",
      "finalFact": false
    },
    {
      "transitionKey": "life_transition_000007",
      "participantKey": "participant_11",
      "transitionType": "death_counter_increment_candidate",
      "timeRefKey": "time_ref_000007",
      "normalizedElapsedSecond": 406,
      "sourceSignal": "controller_death_counter_increment",
      "sourceSignalStatus": "available",
      "candidateConfidence": "high",
      "finalFact": false
    },
    {
      "transitionKey": "life_transition_000008",
      "participantKey": "participant_10",
      "transitionType": "death_counter_increment_candidate",
      "timeRefKey": "time_ref_000008",
      "normalizedElapsedSecond": 432,
      "sourceSignal": "controller_death_counter_increment",
      "sourceSignalStatus": "available",
      "candidateConfidence": "high",
      "finalFact": false
    },
    {
      "transitionKey": "life_transition_000009",
      "participantKey": "participant_05",
      "transitionType": "death_counter_increment_candidate",
      "timeRefKey": "time_ref_000009",
      "normalizedElapsedSecond": 452,
      "sourceSignal": "controller_death_counter_increment",
      "sourceSignalStatus": "available",
      "candidateConfidence": "high",
      "finalFact": false
    },
    {
      "transitionKey": "life_transition_000010",
      "participantKey": "participant_03",
      "transitionType": "death_counter_increment_candidate",
      "timeRefKey": "time_ref_000010",
      "normalizedElapsedSecond": 482,
      "sourceSignal": "controller_death_counter_increment",
      "sourceSignalStatus": "available",
      "candidateConfidence": "high",
      "finalFact": false
    },
    {
      "transitionKey": "life_transition_000011",
      "participantKey": "participant_02",
      "transitionType": "death_counter_increment_candidate",
      "timeRefKey": "time_ref_000011",
      "normalizedElapsedSecond": 484,
      "sourceSignal": "controller_death_counter_increment",
      "sourceSignalStatus": "available",
      "candidateConfidence": "high",
      "finalFact": false
    },
    {
      "transitionKey": "life_transition_000012",
      "participantKey": "participant_11",
      "transitionType": "death_counter_increment_candidate",
      "timeRefKey": "time_ref_000012",
      "normalizedElapsedSecond": 491,
      "sourceSignal": "controller_death_counter_increment",
      "sourceSignalStatus": "available",
      "candidateConfidence": "high",
      "finalFact": false
    },
    {
      "transitionKey": "life_transition_000013",
      "participantKey": "participant_08",
      "transitionType": "death_counter_increment_candidate",
      "timeRefKey": "time_ref_000013",
      "normalizedElapsedSecond": 503,
      "sourceSignal": "controller_death_counter_increment",
      "sourceSignalStatus": "available",
      "candidateConfidence": "high",
      "finalFact": false
    },
    {
      "transitionKey": "life_transition_000014",
      "participantKey": "participant_04",
      "transitionType": "death_counter_increment_candidate",
      "timeRefKey": "time_ref_000014",
      "normalizedElapsedSecond": 504,
      "sourceSignal": "controller_death_counter_increment",
      "sourceSignalStatus": "available",
      "candidateConfidence": "high",
      "finalFact": false
    },
    {
      "transitionKey": "life_transition_000015",
      "participantKey": "participant_12",
      "transitionType": "death_counter_increment_candidate",
      "timeRefKey": "time_ref_000015",
      "normalizedElapsedSecond": 516,
      "sourceSignal": "controller_death_counter_increment",
      "sourceSignalStatus": "available",
      "candidateConfidence": "high",
      "finalFact": false
    },
    {
      "transitionKey": "life_transition_000016",
      "participantKey": "participant_10",
      "transitionType": "death_counter_increment_candidate",
      "timeRefKey": "time_ref_000016",
      "normalizedElapsedSecond": 523,
      "sourceSignal": "controller_death_counter_increment",
      "sourceSignalStatus": "available",
      "candidateConfidence": "high",
      "finalFact": false
    },
    {
      "transitionKey": "life_transition_000017",
      "participantKey": "participant_13",
      "transitionType": "death_counter_increment_candidate",
      "timeRefKey": "time_ref_000017",
      "normalizedElapsedSecond": 694,
      "sourceSignal": "controller_death_counter_increment",
      "sourceSignalStatus": "available",
      "candidateConfidence": "high",
      "finalFact": false
    },
    {
      "transitionKey": "life_transition_000018",
      "participantKey": "participant_05",
      "transitionType": "death_counter_increment_candidate",
      "timeRefKey": "time_ref_000018",
      "normalizedElapsedSecond": 702,
      "sourceSignal": "controller_death_counter_increment",
      "sourceSignalStatus": "available",
      "candidateConfidence": "high",
      "finalFact": false
    },
    {
      "transitionKey": "life_transition_000019",
      "participantKey": "participant_08",
      "transitionType": "death_counter_increment_candidate",
      "timeRefKey": "time_ref_000019",
      "normalizedElapsedSecond": 708,
      "sourceSignal": "controller_death_counter_increment",
      "sourceSignalStatus": "available",
      "candidateConfidence": "high",
      "finalFact": false
    },
    {
      "transitionKey": "life_transition_000020",
      "participantKey": "participant_11",
      "transitionType": "death_counter_increment_candidate",
      "timeRefKey": "time_ref_000020",
      "normalizedElapsedSecond": 740,
      "sourceSignal": "controller_death_counter_increment",
      "sourceSignalStatus": "available",
      "candidateConfidence": "high",
      "finalFact": false
    },
    {
      "transitionKey": "life_transition_000021",
      "participantKey": "participant_13",
      "transitionType": "death_counter_increment_candidate",
      "timeRefKey": "time_ref_000021",
      "normalizedElapsedSecond": 748,
      "sourceSignal": "controller_death_counter_increment",
      "sourceSignalStatus": "available",
      "candidateConfidence": "high",
      "finalFact": false
    },
    {
      "transitionKey": "life_transition_000022",
      "participantKey": "participant_12",
      "transitionType": "death_counter_increment_candidate",
      "timeRefKey": "time_ref_000022",
      "normalizedElapsedSecond": 751,
      "sourceSignal": "controller_death_counter_increment",
      "sourceSignalStatus": "available",
      "candidateConfidence": "high",
      "finalFact": false
    },
    {
      "transitionKey": "life_transition_000023",
      "participantKey": "participant_07",
      "transitionType": "death_counter_increment_candidate",
      "timeRefKey": "time_ref_000023",
      "normalizedElapsedSecond": 755,
      "sourceSignal": "controller_death_counter_increment",
      "sourceSignalStatus": "available",
      "candidateConfidence": "high",
      "finalFact": false
    },
    {